{
  "schema_version": 1,
  "run_id": "__RUN_ID__",
  "manifest_commit": "__MANIFEST_COMMIT__",
  "status": "CANDIDATE",
  "summary": "Temporarily relabel the bootstrap screen as the bounded AI harness probe and update the matching unit assertion.",
  "assumptions": [],
  "unknowns": [],
  "files_to_modify": [
    "app/src/main/java/com/melsuhaimi/sleepapp/bootstrap/CheckpointContract.java",
    "app/src/test/java/com/melsuhaimi/sleepapp/bootstrap/CheckpointContractTest.java"
  ],
  "verification_required": [
    "android-unit-tests",
    "android-assemble-debug"
  ],
  "edits": [
    {
      "path": "app/src/main/java/com/melsuhaimi/sleepapp/bootstrap/CheckpointContract.java",
      "content": "package com.melsuhaimi.sleepapp.bootstrap;\n\npublic final class CheckpointContract {\n    public static final String APPLICATION_ID = \"com.melsuhaimi.sleepapp.bootstrap\";\n    public static final String SCREEN_TEXT = \"Sleep App AI Harness Probe\";\n\n    private CheckpointContract() {}\n}\n"
    },
    {
      "path": "app/src/test/java/com/melsuhaimi/sleepapp/bootstrap/CheckpointContractTest.java",
      "content": "package com.melsuhaimi.sleepapp.bootstrap;\n\nimport static org.junit.Assert.assertEquals;\nimport static org.junit.Assert.assertFalse;\n\nimport org.junit.Test;\n\npublic final class CheckpointContractTest {\n    @Test\n    public void applicationIdentityIsStable() {\n        assertEquals(\"com.melsuhaimi.sleepapp.bootstrap\", CheckpointContract.APPLICATION_ID);\n        assertEquals(\"Sleep App AI Harness Probe\", CheckpointContract.SCREEN_TEXT);\n        assertFalse(CheckpointContract.APPLICATION_ID.isBlank());\n    }\n}\n"
    }
  ]
}
